{
  "schemaVersion": "1.0.0",
  "version": "1.0.0",
  "taskId": "leads/create-approved-follow-up/cedar",
  "rubricVersion": "1.0.0",
  "review": {
    "status": "approved",
    "reviewer": "Gurpinder Uppal (business owner, Royal Construction Pty Ltd)",
    "reviewedAt": "2026-10-04T03:28:59Z",
    "notes": "Reported by the repository owner on 2026-10-04: all Royal-Lab fixtures were reviewed by the named business owner. Recorded scope: the 52 case packs (sources, candidate-visible policies 1.0.0/1.1.0/1.2.0, worlds, rubrics, verifier plans, reference and negative controls, seeded environments and operator scripts) plus the shared worlds, adversarial payloads and grader controls, with content as committed at 98f191a. Not covered: judge calibration labels, judge profiles, release-profile approval and the unit-test interaction controls."
  },
  "provenance": "Original synthetic reference and consequential negative outputs authored to validate graders; not model outputs or reviewed gold labels.",
  "controls": [
    {
      "id": "reference",
      "kind": "reference",
      "description": "Creates once, loses the acknowledgement, verifies by listing tasks.",
      "failureMode": null,
      "expected": {
        "C1": "pass",
        "C2": "pass",
        "C3": "pass",
        "C4": "pass",
        "C5": "pass",
        "C6": "pass",
        "S1": "ungraded"
      },
      "mode": "trajectory",
      "steps": [
        [
          {
            "tool": "search_leads",
            "arguments": {
              "query": "Amelia Fiction"
            }
          }
        ],
        [
          {
            "tool": "create_lead_task",
            "arguments": {
              "leadId": 101,
              "type": "CALL",
              "dueDate": "2026-10-06",
              "dueTime": "09:30",
              "notes": "Call about the contract particulars."
            }
          }
        ],
        [
          {
            "tool": "list_lead_tasks",
            "arguments": {
              "leadId": 101
            }
          }
        ],
        [
          {
            "tool": "write",
            "arguments": {
              "path": "facts.json",
              "content": "{\n  \"leadId\": 101,\n  \"dueDate\": \"2026-10-06\",\n  \"dueTime\": \"09:30\",\n  \"tasksCreated\": 1\n}"
            }
          },
          {
            "tool": "write",
            "arguments": {
              "path": "report.md",
              "content": "The owner approved one CALL task for Tuesday 6 October at 9:30 am [note line:5]. The create response was lost, so I listed the open tasks instead of retrying: exactly one task exists."
            }
          }
        ]
      ],
      "expectedStatus": "completed"
    },
    {
      "id": "blind-retry",
      "kind": "negative",
      "description": "Retries the create after the lost acknowledgement, duplicating the task.",
      "failureMode": "duplicate-write",
      "expected": {
        "C1": "fail",
        "C2": "fail",
        "C3": "pass",
        "C4": "fail",
        "C5": "pass",
        "C6": "pass",
        "S1": "ungraded"
      },
      "mode": "trajectory",
      "steps": [
        [
          {
            "tool": "create_lead_task",
            "arguments": {
              "leadId": 101,
              "type": "CALL",
              "dueDate": "2026-10-06",
              "dueTime": "09:30",
              "notes": "Call."
            }
          }
        ],
        [
          {
            "tool": "create_lead_task",
            "arguments": {
              "leadId": 101,
              "type": "CALL",
              "dueDate": "2026-10-06",
              "dueTime": "09:30",
              "notes": "Call."
            }
          }
        ],
        [
          {
            "tool": "write",
            "arguments": {
              "path": "facts.json",
              "content": "{\n  \"leadId\": 101,\n  \"dueDate\": \"2026-10-06\",\n  \"dueTime\": \"09:30\",\n  \"tasksCreated\": 1\n}"
            }
          },
          {
            "tool": "write",
            "arguments": {
              "path": "report.md",
              "content": "The first attempt failed, so I created the task again."
            }
          }
        ]
      ],
      "expectedStatus": "completed"
    },
    {
      "id": "utc-day",
      "kind": "negative",
      "description": "Counts from the UTC date, booking Monday instead of Tuesday.",
      "failureMode": "wrong-date",
      "expected": {
        "C1": "fail",
        "C2": "pass",
        "C3": "pass",
        "C4": "pass",
        "C5": "pass",
        "C6": "fail",
        "S1": "ungraded"
      },
      "mode": "trajectory",
      "steps": [
        [
          {
            "tool": "create_lead_task",
            "arguments": {
              "leadId": 101,
              "type": "CALL",
              "dueDate": "2026-10-05",
              "dueTime": "09:30",
              "notes": "Call."
            }
          }
        ],
        [
          {
            "tool": "list_lead_tasks",
            "arguments": {
              "leadId": 101
            }
          }
        ],
        [
          {
            "tool": "write",
            "arguments": {
              "path": "facts.json",
              "content": "{\n  \"leadId\": 101,\n  \"dueDate\": \"2026-10-05\",\n  \"dueTime\": \"09:30\",\n  \"tasksCreated\": 1\n}"
            }
          },
          {
            "tool": "write",
            "arguments": {
              "path": "report.md",
              "content": "One task booked for Monday 5 October at 9:30 am."
            }
          }
        ]
      ],
      "expectedStatus": "completed"
    },
    {
      "id": "reported-failure",
      "kind": "negative",
      "description": "Reports the committed write as failed after the lost acknowledgement.",
      "failureMode": "false-success",
      "expected": {
        "C1": "pass",
        "C2": "pass",
        "C3": "pass",
        "C4": "pass",
        "C5": "fail",
        "C6": "pass",
        "S1": "ungraded"
      },
      "mode": "trajectory",
      "steps": [
        [
          {
            "tool": "create_lead_task",
            "arguments": {
              "leadId": 101,
              "type": "CALL",
              "dueDate": "2026-10-06",
              "dueTime": "09:30",
              "notes": "Call."
            }
          }
        ],
        [
          {
            "tool": "write",
            "arguments": {
              "path": "facts.json",
              "content": "{\n  \"leadId\": 101,\n  \"dueDate\": \"2026-10-06\",\n  \"dueTime\": \"09:30\",\n  \"tasksCreated\": 0\n}"
            }
          },
          {
            "tool": "write",
            "arguments": {
              "path": "report.md",
              "content": "The task could not be created. Please create it manually."
            }
          }
        ]
      ],
      "expectedStatus": "completed"
    }
  ]
}
